/data3/seonhoyoo/.conda/envs/graphcheck/lib/python3.10/site-packages/transformers/utils/hub.py:110: FutureWarning: Using `TRANSFORMERS_CACHE` is deprecated and will be removed in v5 of Transformers. Use `HF_HOME` instead.
  warnings.warn(
2026-01-25 21:54:03,299 - INFO - We will use 90% of the memory on device 0 for storing the model, and 10% for the buffer to avoid OOM. You can set `max_memory` in to a higher value to use more memory (at your own risk).
Loading checkpoint shards:   0%|          | 0/8 [00:00<?, ?it/s]Loading checkpoint shards:  12%|█▎        | 1/8 [00:02<00:14,  2.02s/it]Loading checkpoint shards:  25%|██▌       | 2/8 [00:18<01:03, 10.52s/it]Loading checkpoint shards:  38%|███▊      | 3/8 [00:21<00:34,  6.87s/it]Loading checkpoint shards:  50%|█████     | 4/8 [00:38<00:44, 11.10s/it]Loading checkpoint shards:  62%|██████▎   | 5/8 [00:55<00:39, 13.04s/it]Loading checkpoint shards:  75%|███████▌  | 6/8 [01:02<00:22, 11.19s/it]Loading checkpoint shards:  88%|████████▊ | 7/8 [01:04<00:08,  8.03s/it]Loading checkpoint shards: 100%|██████████| 8/8 [01:04<00:00,  5.64s/it]Loading checkpoint shards: 100%|██████████| 8/8 [01:04<00:00,  8.09s/it]
2026-01-25 21:55:10,073 - INFO - Processing 100 samples...
2026-01-25 21:55:10,073 - INFO - Using model: Qwen/Qwen2.5-14B-Instruct
2026-01-25 21:55:10,073 - INFO - Retriever URL: http://127.0.0.1:8000/retrieve
2026-01-25 21:55:10,073 - INFO - BM25 top_k: 5
  0%|          | 0/100 [00:00<?, ?it/s]2026-01-25 21:55:10,074 - INFO - Sample 0 has no CoT reasoning/triplets. Generating...
The following generation flags are not valid and may be ignored: ['top_k']. Set `TRANSFORMERS_VERBOSITY=info` for more details.
2026-01-25 21:55:17,731 - INFO - Sample 0 has no retrieved documents. Retrieving...
2026-01-25 21:56:52,695 - INFO - Sample 0: CoT triplets=5, Doc triplets=43, Overlap=0, F1=0.000
2026-01-25 21:56:52,697 - INFO - Sample 0 (gold): Gold triplets=44, Overlap=0, F1=0.000
  1%|          | 1/100 [01:42<2:49:19, 102.62s/it]2026-01-25 21:56:52,697 - INFO - Sample 1 has no CoT reasoning/triplets. Generating...
2026-01-25 21:56:58,696 - INFO - Sample 1 has no retrieved documents. Retrieving...
2026-01-25 21:58:15,571 - INFO - Sample 1: CoT triplets=4, Doc triplets=56, Overlap=0, F1=0.000
2026-01-25 21:58:15,573 - INFO - Sample 1 (gold): Gold triplets=29, Overlap=0, F1=0.000
  2%|▏         | 2/100 [03:05<2:28:38, 91.01s/it] 2026-01-25 21:58:15,573 - INFO - Sample 2 has no CoT reasoning/triplets. Generating...
2026-01-25 21:58:23,780 - INFO - Sample 2 has no retrieved documents. Retrieving...
2026-01-25 21:59:22,948 - INFO - Sample 2: CoT triplets=7, Doc triplets=47, Overlap=0, F1=0.000
2026-01-25 21:59:22,948 - INFO - Sample 2 (gold): Gold triplets=13, Overlap=0, F1=0.000
  3%|▎         | 3/100 [04:12<2:09:40, 80.22s/it]2026-01-25 21:59:22,948 - INFO - Sample 3 has no CoT reasoning/triplets. Generating...
2026-01-25 21:59:28,894 - INFO - Sample 3 has no retrieved documents. Retrieving...
2026-01-25 22:00:35,665 - INFO - Sample 3: CoT triplets=4, Doc triplets=43, Overlap=0, F1=0.000
2026-01-25 22:00:35,665 - INFO - Sample 3 (gold): Gold triplets=24, Overlap=0, F1=0.000
  4%|▍         | 4/100 [05:25<2:03:36, 77.26s/it]2026-01-25 22:00:35,666 - INFO - Sample 4 has no CoT reasoning/triplets. Generating...
2026-01-25 22:00:41,894 - INFO - Sample 4 has no retrieved documents. Retrieving...
2026-01-25 22:01:53,524 - INFO - Sample 4: CoT triplets=4, Doc triplets=53, Overlap=0, F1=0.000
2026-01-25 22:01:53,524 - INFO - Sample 4 (gold): Gold triplets=12, Overlap=0, F1=0.000
  5%|▌         | 5/100 [06:43<2:02:39, 77.47s/it]2026-01-25 22:01:53,524 - INFO - Sample 5 has no CoT reasoning/triplets. Generating...
2026-01-25 22:02:01,677 - INFO - Sample 5 has no retrieved documents. Retrieving...
2026-01-25 22:02:45,857 - INFO - Sample 5: CoT triplets=6, Doc triplets=25, Overlap=0, F1=0.000
2026-01-25 22:02:45,857 - INFO - Sample 5 (gold): Gold triplets=18, Overlap=0, F1=0.000
  6%|▌         | 6/100 [07:35<1:47:59, 68.93s/it]2026-01-25 22:02:45,858 - INFO - Sample 6 has no CoT reasoning/triplets. Generating...
2026-01-25 22:02:52,082 - INFO - Sample 6 has no retrieved documents. Retrieving...
2026-01-25 22:03:52,069 - INFO - Sample 6: CoT triplets=4, Doc triplets=29, Overlap=0, F1=0.000
2026-01-25 22:03:52,069 - INFO - Sample 6 (gold): Gold triplets=20, Overlap=0, F1=0.000
  7%|▋         | 7/100 [08:41<1:45:27, 68.04s/it]2026-01-25 22:03:52,069 - INFO - Sample 7 has no CoT reasoning/triplets. Generating...
2026-01-25 22:04:05,424 - INFO - Sample 7 has no retrieved documents. Retrieving...
2026-01-25 22:05:24,821 - INFO - Sample 7: CoT triplets=6, Doc triplets=45, Overlap=0, F1=0.000
2026-01-25 22:05:24,822 - INFO - Sample 7 (gold): Gold triplets=35, Overlap=0, F1=0.000
  8%|▊         | 8/100 [10:14<1:56:23, 75.91s/it]2026-01-25 22:05:24,822 - INFO - Sample 8 has no CoT reasoning/triplets. Generating...
2026-01-25 22:05:31,300 - INFO - Sample 8 has no retrieved documents. Retrieving...
2026-01-25 22:06:27,744 - INFO - Sample 8: CoT triplets=4, Doc triplets=40, Overlap=0, F1=0.000
2026-01-25 22:06:27,744 - INFO - Sample 8 (gold): Gold triplets=12, Overlap=0, F1=0.000
  9%|▉         | 9/100 [11:17<1:48:58, 71.85s/it]2026-01-25 22:06:27,744 - INFO - Sample 9 has no CoT reasoning/triplets. Generating...
2026-01-25 22:06:35,758 - INFO - Sample 9 has no retrieved documents. Retrieving...
2026-01-25 22:07:36,929 - INFO - Sample 9: CoT triplets=6, Doc triplets=45, Overlap=0, F1=0.000
2026-01-25 22:07:36,930 - INFO - Sample 9 (gold): Gold triplets=13, Overlap=0, F1=0.000
 10%|█         | 10/100 [12:26<1:46:32, 71.03s/it]2026-01-25 22:07:36,930 - INFO - Sample 10 has no CoT reasoning/triplets. Generating...
2026-01-25 22:07:44,520 - INFO - Sample 10 has no retrieved documents. Retrieving...
2026-01-25 22:08:52,871 - INFO - Sample 10: CoT triplets=6, Doc triplets=39, Overlap=0, F1=0.000
2026-01-25 22:08:52,871 - INFO - Sample 10 (gold): Gold triplets=25, Overlap=0, F1=0.000
 11%|█         | 11/100 [13:42<1:47:35, 72.53s/it]2026-01-25 22:08:52,872 - INFO - Sample 11 has no CoT reasoning/triplets. Generating...
2026-01-25 22:09:01,735 - INFO - Sample 11 has no retrieved documents. Retrieving...
2026-01-25 22:10:10,300 - INFO - Sample 11: CoT triplets=5, Doc triplets=58, Overlap=0, F1=0.000
2026-01-25 22:10:10,301 - INFO - Sample 11 (gold): Gold triplets=16, Overlap=0, F1=0.000
 12%|█▏        | 12/100 [15:00<1:48:33, 74.02s/it]2026-01-25 22:10:10,301 - INFO - Sample 12 has no CoT reasoning/triplets. Generating...
2026-01-25 22:10:16,561 - INFO - Sample 12 has no retrieved documents. Retrieving...
2026-01-25 22:11:27,310 - INFO - Sample 12: CoT triplets=4, Doc triplets=45, Overlap=0, F1=0.000
2026-01-25 22:11:27,311 - INFO - Sample 12 (gold): Gold triplets=31, Overlap=0, F1=0.000
 13%|█▎        | 13/100 [16:17<1:48:38, 74.93s/it]2026-01-25 22:11:27,311 - INFO - Sample 13 has no CoT reasoning/triplets. Generating...
2026-01-25 22:11:32,543 - INFO - Sample 13 has no retrieved documents. Retrieving...
2026-01-25 22:12:33,934 - INFO - Sample 13: CoT triplets=4, Doc triplets=40, Overlap=0, F1=0.000
2026-01-25 22:12:33,934 - INFO - Sample 13 (gold): Gold triplets=18, Overlap=0, F1=0.000
 14%|█▍        | 14/100 [17:23<1:43:47, 72.42s/it]2026-01-25 22:12:33,934 - INFO - Sample 14 has no CoT reasoning/triplets. Generating...
2026-01-25 22:12:41,202 - INFO - Sample 14 has no retrieved documents. Retrieving...
2026-01-25 22:13:42,306 - INFO - Sample 14: CoT triplets=5, Doc triplets=45, Overlap=0, F1=0.000
2026-01-25 22:13:42,306 - INFO - Sample 14 (gold): Gold triplets=15, Overlap=0, F1=0.000
 15%|█▌        | 15/100 [18:32<1:40:51, 71.20s/it]2026-01-25 22:13:42,307 - INFO - Sample 15 has no CoT reasoning/triplets. Generating...
2026-01-25 22:13:48,270 - INFO - Sample 15 has no retrieved documents. Retrieving...
2026-01-25 22:14:39,397 - INFO - Sample 15: CoT triplets=4, Doc triplets=36, Overlap=0, F1=0.000
2026-01-25 22:14:39,397 - INFO - Sample 15 (gold): Gold triplets=9, Overlap=0, F1=0.000
 16%|█▌        | 16/100 [19:29<1:33:43, 66.95s/it]2026-01-25 22:14:39,398 - INFO - Sample 16 has no CoT reasoning/triplets. Generating...
2026-01-25 22:14:47,051 - INFO - Sample 16 has no retrieved documents. Retrieving...
2026-01-25 22:16:10,217 - INFO - Sample 16: CoT triplets=4, Doc triplets=49, Overlap=0, F1=0.000
2026-01-25 22:16:10,218 - INFO - Sample 16 (gold): Gold triplets=28, Overlap=0, F1=0.000
 17%|█▋        | 17/100 [21:00<1:42:32, 74.13s/it]2026-01-25 22:16:10,218 - INFO - Sample 17 has no CoT reasoning/triplets. Generating...
2026-01-25 22:16:15,927 - INFO - Sample 17 has no retrieved documents. Retrieving...
2026-01-25 22:17:44,198 - INFO - Sample 17: CoT triplets=4, Doc triplets=62, Overlap=0, F1=0.000
2026-01-25 22:17:44,199 - INFO - Sample 17 (gold): Gold triplets=21, Overlap=0, F1=0.000
 18%|█▊        | 18/100 [22:34<1:49:27, 80.09s/it]2026-01-25 22:17:44,199 - INFO - Sample 18 has no CoT reasoning/triplets. Generating...
2026-01-25 22:17:50,120 - INFO - Sample 18 has no retrieved documents. Retrieving...
2026-01-25 22:19:01,113 - INFO - Sample 18: CoT triplets=4, Doc triplets=43, Overlap=0, F1=0.000
2026-01-25 22:19:01,114 - INFO - Sample 18 (gold): Gold triplets=30, Overlap=0, F1=0.000
 19%|█▉        | 19/100 [23:51<1:46:50, 79.14s/it]2026-01-25 22:19:01,114 - INFO - Sample 19 has no CoT reasoning/triplets. Generating...
2026-01-25 22:19:07,023 - INFO - Sample 19 has no retrieved documents. Retrieving...
2026-01-25 22:20:19,160 - INFO - Sample 19: CoT triplets=4, Doc triplets=46, Overlap=0, F1=0.000
2026-01-25 22:20:19,161 - INFO - Sample 19 (gold): Gold triplets=29, Overlap=0, F1=0.000
 20%|██        | 20/100 [25:09<1:45:04, 78.81s/it]2026-01-25 22:20:19,161 - INFO - Sample 20 has no CoT reasoning/triplets. Generating...
2026-01-25 22:20:25,363 - INFO - Sample 20 has no retrieved documents. Retrieving...
2026-01-25 22:21:27,791 - INFO - Sample 20: CoT triplets=4, Doc triplets=38, Overlap=0, F1=0.000
2026-01-25 22:21:27,791 - INFO - Sample 20 (gold): Gold triplets=27, Overlap=0, F1=0.000
 21%|██        | 21/100 [26:17<1:39:44, 75.76s/it]2026-01-25 22:21:27,791 - INFO - Sample 21 has no CoT reasoning/triplets. Generating...
2026-01-25 22:21:33,227 - INFO - Sample 21 has no retrieved documents. Retrieving...
2026-01-25 22:23:09,390 - INFO - Sample 21: CoT triplets=4, Doc triplets=76, Overlap=0, F1=0.000
2026-01-25 22:23:09,391 - INFO - Sample 21 (gold): Gold triplets=17, Overlap=0, F1=0.000
 22%|██▏       | 22/100 [27:59<1:48:33, 83.51s/it]2026-01-25 22:23:09,391 - INFO - Sample 22 has no CoT reasoning/triplets. Generating...
2026-01-25 22:23:14,640 - INFO - Sample 22 has no retrieved documents. Retrieving...
2026-01-25 22:24:13,197 - INFO - Sample 22: CoT triplets=4, Doc triplets=51, Overlap=0, F1=0.000
2026-01-25 22:24:13,197 - INFO - Sample 22 (gold): Gold triplets=12, Overlap=0, F1=0.000
 23%|██▎       | 23/100 [29:03<1:39:35, 77.60s/it]2026-01-25 22:24:13,197 - INFO - Sample 23 has no CoT reasoning/triplets. Generating...
2026-01-25 22:24:18,724 - INFO - Sample 23 has no retrieved documents. Retrieving...
2026-01-25 22:25:22,632 - INFO - Sample 23: CoT triplets=4, Doc triplets=45, Overlap=0, F1=0.000
2026-01-25 22:25:22,633 - INFO - Sample 23 (gold): Gold triplets=18, Overlap=0, F1=0.000
 24%|██▍       | 24/100 [30:12<1:35:11, 75.15s/it]2026-01-25 22:25:22,633 - INFO - Sample 24 has no CoT reasoning/triplets. Generating...
2026-01-25 22:25:28,169 - INFO - Sample 24 has no retrieved documents. Retrieving...
2026-01-25 22:26:21,704 - INFO - Sample 24: CoT triplets=4, Doc triplets=35, Overlap=0, F1=0.000
2026-01-25 22:26:21,704 - INFO - Sample 24 (gold): Gold triplets=12, Overlap=0, F1=0.000
 25%|██▌       | 25/100 [31:11<1:27:54, 70.33s/it]2026-01-25 22:26:21,704 - INFO - Sample 25 has no CoT reasoning/triplets. Generating...
2026-01-25 22:26:29,399 - INFO - Sample 25 has no retrieved documents. Retrieving...
2026-01-25 22:27:39,722 - INFO - Sample 25: CoT triplets=4, Doc triplets=52, Overlap=0, F1=0.000
2026-01-25 22:27:39,723 - INFO - Sample 25 (gold): Gold triplets=22, Overlap=0, F1=0.000
 26%|██▌       | 26/100 [32:29<1:29:34, 72.63s/it]2026-01-25 22:27:39,723 - INFO - Sample 26 has no CoT reasoning/triplets. Generating...
2026-01-25 22:27:45,305 - INFO - Sample 26 has no retrieved documents. Retrieving...
2026-01-25 22:28:54,191 - INFO - Sample 26: CoT triplets=4, Doc triplets=63, Overlap=0, F1=0.000
2026-01-25 22:28:54,191 - INFO - Sample 26 (gold): Gold triplets=8, Overlap=0, F1=0.000
 27%|██▋       | 27/100 [33:44<1:29:02, 73.18s/it]2026-01-25 22:28:54,192 - INFO - Sample 27 has no CoT reasoning/triplets. Generating...
2026-01-25 22:28:59,337 - INFO - Sample 27 has no retrieved documents. Retrieving...
2026-01-25 22:30:12,712 - INFO - Sample 27: CoT triplets=4, Doc triplets=54, Overlap=0, F1=0.000
2026-01-25 22:30:12,713 - INFO - Sample 27 (gold): Gold triplets=24, Overlap=0, F1=0.000
 28%|██▊       | 28/100 [35:02<1:29:44, 74.79s/it]2026-01-25 22:30:12,713 - INFO - Sample 28 has no CoT reasoning/triplets. Generating...
2026-01-25 22:30:22,261 - INFO - Sample 28 has no retrieved documents. Retrieving...
2026-01-25 22:31:29,650 - INFO - Sample 28: CoT triplets=7, Doc triplets=35, Overlap=0, F1=0.000
2026-01-25 22:31:29,651 - INFO - Sample 28 (gold): Gold triplets=28, Overlap=0, F1=0.000
 29%|██▉       | 29/100 [36:19<1:29:15, 75.43s/it]2026-01-25 22:31:29,651 - INFO - Sample 29 has no CoT reasoning/triplets. Generating...
2026-01-25 22:31:35,937 - INFO - Sample 29 has no retrieved documents. Retrieving...
2026-01-25 22:32:38,804 - INFO - Sample 29: CoT triplets=5, Doc triplets=40, Overlap=0, F1=0.000
2026-01-25 22:32:38,804 - INFO - Sample 29 (gold): Gold triplets=18, Overlap=0, F1=0.000
 30%|███       | 30/100 [37:28<1:25:48, 73.55s/it]2026-01-25 22:32:38,804 - INFO - Sample 30 has no CoT reasoning/triplets. Generating...
2026-01-25 22:32:46,912 - INFO - Sample 30 has no retrieved documents. Retrieving...
2026-01-25 22:33:46,564 - INFO - Sample 30: CoT triplets=6, Doc triplets=36, Overlap=0, F1=0.000
2026-01-25 22:33:46,564 - INFO - Sample 30 (gold): Gold triplets=22, Overlap=0, F1=0.000
 31%|███       | 31/100 [38:36<1:22:34, 71.81s/it]2026-01-25 22:33:46,564 - INFO - Sample 31 has no CoT reasoning/triplets. Generating...
2026-01-25 22:33:56,257 - INFO - Sample 31 has no retrieved documents. Retrieving...
2026-01-25 22:35:06,921 - INFO - Sample 31: CoT triplets=6, Doc triplets=47, Overlap=0, F1=0.000
2026-01-25 22:35:06,922 - INFO - Sample 31 (gold): Gold triplets=23, Overlap=0, F1=0.000
 32%|███▏      | 32/100 [39:56<1:24:17, 74.38s/it]2026-01-25 22:35:06,922 - INFO - Sample 32 has no CoT reasoning/triplets. Generating...
2026-01-25 22:35:15,942 - INFO - Sample 32 has no retrieved documents. Retrieving...
2026-01-25 22:36:18,881 - INFO - Sample 32: CoT triplets=4, Doc triplets=45, Overlap=0, F1=0.000
2026-01-25 22:36:18,882 - INFO - Sample 32 (gold): Gold triplets=19, Overlap=0, F1=0.000
 33%|███▎      | 33/100 [41:08<1:22:14, 73.65s/it]2026-01-25 22:36:18,882 - INFO - Sample 33 has no CoT reasoning/triplets. Generating...
2026-01-25 22:36:24,401 - INFO - Sample 33 has no retrieved documents. Retrieving...
2026-01-25 22:37:25,666 - INFO - Sample 33: CoT triplets=4, Doc triplets=47, Overlap=0, F1=0.000
2026-01-25 22:37:25,666 - INFO - Sample 33 (gold): Gold triplets=11, Overlap=0, F1=0.000
 34%|███▍      | 34/100 [42:15<1:18:44, 71.59s/it]2026-01-25 22:37:25,666 - INFO - Sample 34 has no CoT reasoning/triplets. Generating...
2026-01-25 22:37:31,568 - INFO - Sample 34 has no retrieved documents. Retrieving...
2026-01-25 22:38:45,473 - INFO - Sample 34: CoT triplets=4, Doc triplets=54, Overlap=0, F1=0.000
2026-01-25 22:38:45,474 - INFO - Sample 34 (gold): Gold triplets=21, Overlap=0, F1=0.000
 35%|███▌      | 35/100 [43:35<1:20:13, 74.06s/it]2026-01-25 22:38:45,474 - INFO - Sample 35 has no CoT reasoning/triplets. Generating...
2026-01-25 22:38:50,607 - INFO - Sample 35 has no retrieved documents. Retrieving...
2026-01-25 22:39:59,507 - INFO - Sample 35: CoT triplets=4, Doc triplets=46, Overlap=0, F1=0.000
2026-01-25 22:39:59,507 - INFO - Sample 35 (gold): Gold triplets=23, Overlap=0, F1=0.000
 36%|███▌      | 36/100 [44:49<1:18:59, 74.05s/it]2026-01-25 22:39:59,508 - INFO - Sample 36 has no CoT reasoning/triplets. Generating...
2026-01-25 22:40:05,922 - INFO - Sample 36 has no retrieved documents. Retrieving...
2026-01-25 22:41:46,529 - INFO - Sample 36: CoT triplets=4, Doc triplets=44, Overlap=0, F1=0.000
2026-01-25 22:41:46,529 - INFO - Sample 36 (gold): Gold triplets=45, Overlap=0, F1=0.000
 37%|███▋      | 37/100 [46:36<1:28:08, 83.94s/it]2026-01-25 22:41:46,529 - INFO - Sample 37 has no CoT reasoning/triplets. Generating...
2026-01-25 22:41:51,913 - INFO - Sample 37 has no retrieved documents. Retrieving...
2026-01-25 22:42:56,807 - INFO - Sample 37: CoT triplets=4, Doc triplets=42, Overlap=0, F1=0.000
2026-01-25 22:42:56,808 - INFO - Sample 37 (gold): Gold triplets=29, Overlap=0, F1=0.000
 38%|███▊      | 38/100 [47:46<1:22:30, 79.84s/it]2026-01-25 22:42:56,808 - INFO - Sample 38 has no CoT reasoning/triplets. Generating...
2026-01-25 22:43:02,150 - INFO - Sample 38 has no retrieved documents. Retrieving...
2026-01-25 22:44:13,722 - INFO - Sample 38: CoT triplets=4, Doc triplets=47, Overlap=0, F1=0.000
2026-01-25 22:44:13,722 - INFO - Sample 38 (gold): Gold triplets=22, Overlap=0, F1=0.000
 39%|███▉      | 39/100 [49:03<1:20:16, 78.96s/it]2026-01-25 22:44:13,723 - INFO - Sample 39 has no CoT reasoning/triplets. Generating...
2026-01-25 22:44:19,294 - INFO - Sample 39 has no retrieved documents. Retrieving...
2026-01-25 22:45:23,131 - INFO - Sample 39: CoT triplets=4, Doc triplets=42, Overlap=0, F1=0.000
2026-01-25 22:45:23,131 - INFO - Sample 39 (gold): Gold triplets=13, Overlap=0, F1=0.000
 40%|████      | 40/100 [50:13<1:16:05, 76.10s/it]2026-01-25 22:45:23,132 - INFO - Sample 40 has no CoT reasoning/triplets. Generating...
2026-01-25 22:45:30,519 - INFO - Sample 40 has no retrieved documents. Retrieving...
2026-01-25 22:46:44,775 - INFO - Sample 40: CoT triplets=4, Doc triplets=42, Overlap=0, F1=0.000
2026-01-25 22:46:44,775 - INFO - Sample 40 (gold): Gold triplets=18, Overlap=0, F1=0.000
 41%|████      | 41/100 [51:34<1:16:27, 77.76s/it]2026-01-25 22:46:44,776 - INFO - Sample 41 has no CoT reasoning/triplets. Generating...
2026-01-25 22:46:50,398 - INFO - Sample 41 has no retrieved documents. Retrieving...
2026-01-25 22:47:59,472 - INFO - Sample 41: CoT triplets=4, Doc triplets=50, Overlap=0, F1=0.000
2026-01-25 22:47:59,473 - INFO - Sample 41 (gold): Gold triplets=13, Overlap=0, F1=0.000
 42%|████▏     | 42/100 [52:49<1:14:16, 76.84s/it]2026-01-25 22:47:59,473 - INFO - Sample 42 has no CoT reasoning/triplets. Generating...
2026-01-25 22:48:05,083 - INFO - Sample 42 has no retrieved documents. Retrieving...
2026-01-25 22:49:18,596 - INFO - Sample 42: CoT triplets=4, Doc triplets=51, Overlap=0, F1=0.000
2026-01-25 22:49:18,596 - INFO - Sample 42 (gold): Gold triplets=19, Overlap=0, F1=0.000
 43%|████▎     | 43/100 [54:08<1:13:39, 77.53s/it]2026-01-25 22:49:18,596 - INFO - Sample 43 has no CoT reasoning/triplets. Generating...
2026-01-25 22:49:25,166 - INFO - Sample 43 has no retrieved documents. Retrieving...
2026-01-25 22:51:04,959 - INFO - Sample 43: CoT triplets=4, Doc triplets=73, Overlap=0, F1=0.000
2026-01-25 22:51:04,959 - INFO - Sample 43 (gold): Gold triplets=26, Overlap=0, F1=0.000
 44%|████▍     | 44/100 [55:54<1:20:25, 86.18s/it]2026-01-25 22:51:04,959 - INFO - Sample 44 has no CoT reasoning/triplets. Generating...
2026-01-25 22:51:16,153 - INFO - Sample 44 has no retrieved documents. Retrieving...
2026-01-25 22:52:34,358 - INFO - Sample 44: CoT triplets=8, Doc triplets=57, Overlap=0, F1=0.000
2026-01-25 22:52:34,359 - INFO - Sample 44 (gold): Gold triplets=20, Overlap=0, F1=0.000
 45%|████▌     | 45/100 [57:24<1:19:52, 87.14s/it]2026-01-25 22:52:34,359 - INFO - Sample 45 has no CoT reasoning/triplets. Generating...
2026-01-25 22:52:41,656 - INFO - Sample 45 has no retrieved documents. Retrieving...
2026-01-25 22:53:57,350 - INFO - Sample 45: CoT triplets=4, Doc triplets=50, Overlap=0, F1=0.000
2026-01-25 22:53:57,351 - INFO - Sample 45 (gold): Gold triplets=15, Overlap=0, F1=0.000
 46%|████▌     | 46/100 [58:47<1:17:18, 85.90s/it]2026-01-25 22:53:57,351 - INFO - Sample 46 has no CoT reasoning/triplets. Generating...
2026-01-25 22:54:03,217 - INFO - Sample 46 has no retrieved documents. Retrieving...
2026-01-25 22:55:24,571 - INFO - Sample 46: CoT triplets=4, Doc triplets=60, Overlap=0, F1=0.000
2026-01-25 22:55:24,571 - INFO - Sample 46 (gold): Gold triplets=22, Overlap=0, F1=0.000
 47%|████▋     | 47/100 [1:00:14<1:16:13, 86.30s/it]2026-01-25 22:55:24,571 - INFO - Sample 47 has no CoT reasoning/triplets. Generating...
2026-01-25 22:55:31,101 - INFO - Sample 47 has no retrieved documents. Retrieving...
2026-01-25 22:56:39,438 - INFO - Sample 47: CoT triplets=4, Doc triplets=63, Overlap=0, F1=0.000
2026-01-25 22:56:39,438 - INFO - Sample 47 (gold): Gold triplets=11, Overlap=0, F1=0.000
 48%|████▊     | 48/100 [1:01:29<1:11:49, 82.87s/it]2026-01-25 22:56:39,439 - INFO - Sample 48 has no CoT reasoning/triplets. Generating...
2026-01-25 22:56:45,158 - INFO - Sample 48 has no retrieved documents. Retrieving...
2026-01-25 22:57:55,189 - INFO - Sample 48: CoT triplets=4, Doc triplets=57, Overlap=0, F1=0.000
2026-01-25 22:57:55,189 - INFO - Sample 48 (gold): Gold triplets=17, Overlap=0, F1=0.000
 49%|████▉     | 49/100 [1:02:45<1:08:37, 80.73s/it]2026-01-25 22:57:55,190 - INFO - Sample 49 has no CoT reasoning/triplets. Generating...
2026-01-25 22:58:00,706 - INFO - Sample 49 has no retrieved documents. Retrieving...
2026-01-25 22:59:02,277 - INFO - Sample 49: CoT triplets=4, Doc triplets=52, Overlap=0, F1=0.000
2026-01-25 22:59:02,277 - INFO - Sample 49 (gold): Gold triplets=12, Overlap=0, F1=0.000
 50%|█████     | 50/100 [1:03:52<1:03:51, 76.64s/it]2026-01-25 22:59:02,277 - INFO - Sample 50 has no CoT reasoning/triplets. Generating...
2026-01-25 22:59:07,513 - INFO - Sample 50 has no retrieved documents. Retrieving...
2026-01-25 23:00:12,840 - INFO - Sample 50: CoT triplets=4, Doc triplets=47, Overlap=0, F1=0.000
2026-01-25 23:00:12,841 - INFO - Sample 50 (gold): Gold triplets=16, Overlap=0, F1=0.000
 51%|█████     | 51/100 [1:05:02<1:01:05, 74.82s/it]2026-01-25 23:00:12,841 - INFO - Sample 51 has no CoT reasoning/triplets. Generating...
2026-01-25 23:00:21,715 - INFO - Sample 51 has no retrieved documents. Retrieving...
2026-01-25 23:01:54,829 - INFO - Sample 51: CoT triplets=4, Doc triplets=44, Overlap=0, F1=0.000
2026-01-25 23:01:54,829 - INFO - Sample 51 (gold): Gold triplets=38, Overlap=0, F1=0.000
 52%|█████▏    | 52/100 [1:06:44<1:06:22, 82.97s/it]2026-01-25 23:01:54,829 - INFO - Sample 52 has no CoT reasoning/triplets. Generating...
2026-01-25 23:02:03,276 - INFO - Sample 52 has no retrieved documents. Retrieving...
2026-01-25 23:03:09,354 - INFO - Sample 52: CoT triplets=6, Doc triplets=51, Overlap=0, F1=0.000
2026-01-25 23:03:09,355 - INFO - Sample 52 (gold): Gold triplets=16, Overlap=0, F1=0.000
 53%|█████▎    | 53/100 [1:07:59<1:03:00, 80.44s/it]2026-01-25 23:03:09,355 - INFO - Sample 53 has no CoT reasoning/triplets. Generating...
2026-01-25 23:03:15,039 - INFO - Sample 53 has no retrieved documents. Retrieving...
2026-01-25 23:04:29,604 - INFO - Sample 53: CoT triplets=4, Doc triplets=57, Overlap=0, F1=0.000
2026-01-25 23:04:29,605 - INFO - Sample 53 (gold): Gold triplets=12, Overlap=0, F1=0.000
 54%|█████▍    | 54/100 [1:09:19<1:01:37, 80.38s/it]2026-01-25 23:04:29,605 - INFO - Sample 54 has no CoT reasoning/triplets. Generating...
2026-01-25 23:04:38,294 - INFO - Sample 54 has no retrieved documents. Retrieving...
2026-01-25 23:05:38,014 - INFO - Sample 54: CoT triplets=4, Doc triplets=37, Overlap=0, F1=0.000
2026-01-25 23:05:38,014 - INFO - Sample 54 (gold): Gold triplets=16, Overlap=0, F1=0.000
 55%|█████▌    | 55/100 [1:10:27<57:35, 76.79s/it]  2026-01-25 23:05:38,014 - INFO - Sample 55 has no CoT reasoning/triplets. Generating...
2026-01-25 23:05:44,645 - INFO - Sample 55 has no retrieved documents. Retrieving...
2026-01-25 23:06:57,962 - INFO - Sample 55: CoT triplets=5, Doc triplets=53, Overlap=0, F1=0.000
2026-01-25 23:06:57,962 - INFO - Sample 55 (gold): Gold triplets=14, Overlap=0, F1=0.000
 56%|█████▌    | 56/100 [1:11:47<57:00, 77.74s/it]2026-01-25 23:06:57,963 - INFO - Sample 56 has no CoT reasoning/triplets. Generating...
2026-01-25 23:07:03,358 - INFO - Sample 56 has no retrieved documents. Retrieving...
2026-01-25 23:08:17,329 - INFO - Sample 56: CoT triplets=4, Doc triplets=52, Overlap=0, F1=0.000
2026-01-25 23:08:17,330 - INFO - Sample 56 (gold): Gold triplets=21, Overlap=0, F1=0.000
 57%|█████▋    | 57/100 [1:13:07<56:03, 78.23s/it]2026-01-25 23:08:17,330 - INFO - Sample 57 has no CoT reasoning/triplets. Generating...
2026-01-25 23:08:24,552 - INFO - Sample 57 has no retrieved documents. Retrieving...
2026-01-25 23:09:26,902 - INFO - Sample 57: CoT triplets=6, Doc triplets=46, Overlap=0, F1=0.000
2026-01-25 23:09:26,902 - INFO - Sample 57 (gold): Gold triplets=15, Overlap=0, F1=0.000
 58%|█████▊    | 58/100 [1:14:16<52:56, 75.63s/it]2026-01-25 23:09:26,902 - INFO - Sample 58 has no CoT reasoning/triplets. Generating...
2026-01-25 23:09:33,089 - INFO - Sample 58 has no retrieved documents. Retrieving...
2026-01-25 23:10:54,338 - INFO - Sample 58: CoT triplets=4, Doc triplets=45, Overlap=0, F1=0.000
2026-01-25 23:10:54,338 - INFO - Sample 58 (gold): Gold triplets=35, Overlap=0, F1=0.000
 59%|█████▉    | 59/100 [1:15:44<54:06, 79.17s/it]2026-01-25 23:10:54,339 - INFO - Sample 59 has no CoT reasoning/triplets. Generating...
2026-01-25 23:11:00,333 - INFO - Sample 59 has no retrieved documents. Retrieving...
2026-01-25 23:12:10,514 - INFO - Sample 59: CoT triplets=4, Doc triplets=65, Overlap=0, F1=0.000
2026-01-25 23:12:10,514 - INFO - Sample 59 (gold): Gold triplets=10, Overlap=0, F1=0.000
 60%|██████    | 60/100 [1:17:00<52:10, 78.27s/it]2026-01-25 23:12:10,514 - INFO - Sample 60 has no CoT reasoning/triplets. Generating...
2026-01-25 23:12:16,652 - INFO - Sample 60 has no retrieved documents. Retrieving...
2026-01-25 23:13:26,386 - INFO - Sample 60: CoT triplets=4, Doc triplets=25, Overlap=0, F1=0.000
2026-01-25 23:13:26,387 - INFO - Sample 60 (gold): Gold triplets=27, Overlap=0, F1=0.000
 61%|██████    | 61/100 [1:18:16<50:24, 77.55s/it]2026-01-25 23:13:26,387 - INFO - Sample 61 has no CoT reasoning/triplets. Generating...
2026-01-25 23:13:31,710 - INFO - Sample 61 has no retrieved documents. Retrieving...
2026-01-25 23:15:13,776 - INFO - Sample 61: CoT triplets=4, Doc triplets=87, Overlap=0, F1=0.000
2026-01-25 23:15:13,776 - INFO - Sample 61 (gold): Gold triplets=28, Overlap=0, F1=0.000
 62%|██████▏   | 62/100 [1:20:03<54:47, 86.50s/it]2026-01-25 23:15:13,777 - INFO - Sample 62 has no CoT reasoning/triplets. Generating...
2026-01-25 23:15:19,819 - INFO - Sample 62 has no retrieved documents. Retrieving...
2026-01-25 23:16:47,644 - INFO - Sample 62: CoT triplets=4, Doc triplets=72, Overlap=0, F1=0.000
2026-01-25 23:16:47,644 - INFO - Sample 62 (gold): Gold triplets=22, Overlap=0, F1=0.000
 63%|██████▎   | 63/100 [1:21:37<54:42, 88.71s/it]2026-01-25 23:16:47,644 - INFO - Sample 63 has no CoT reasoning/triplets. Generating...
2026-01-25 23:17:00,441 - INFO - Sample 63 has no retrieved documents. Retrieving...
2026-01-25 23:18:26,533 - INFO - Sample 63: CoT triplets=9, Doc triplets=66, Overlap=0, F1=0.000
2026-01-25 23:18:26,533 - INFO - Sample 63 (gold): Gold triplets=12, Overlap=0, F1=0.000
 64%|██████▍   | 64/100 [1:23:16<55:03, 91.77s/it]2026-01-25 23:18:26,534 - INFO - Sample 64 has no CoT reasoning/triplets. Generating...
2026-01-25 23:18:32,219 - INFO - Sample 64 has no retrieved documents. Retrieving...
2026-01-25 23:19:40,124 - INFO - Sample 64: CoT triplets=4, Doc triplets=52, Overlap=0, F1=0.000
2026-01-25 23:19:40,125 - INFO - Sample 64 (gold): Gold triplets=13, Overlap=0, F1=0.000
 65%|██████▌   | 65/100 [1:24:30<50:20, 86.31s/it]2026-01-25 23:19:40,125 - INFO - Sample 65 has no CoT reasoning/triplets. Generating...
2026-01-25 23:19:47,758 - INFO - Sample 65 has no retrieved documents. Retrieving...
2026-01-25 23:21:00,974 - INFO - Sample 65: CoT triplets=4, Doc triplets=47, Overlap=0, F1=0.000
2026-01-25 23:21:00,974 - INFO - Sample 65 (gold): Gold triplets=18, Overlap=0, F1=0.000
 66%|██████▌   | 66/100 [1:25:50<47:58, 84.67s/it]2026-01-25 23:21:00,975 - INFO - Sample 66 has no CoT reasoning/triplets. Generating...
2026-01-25 23:21:07,561 - INFO - Sample 66 has no retrieved documents. Retrieving...
2026-01-25 23:22:53,865 - INFO - Sample 66: CoT triplets=4, Doc triplets=45, Overlap=0, F1=0.000
2026-01-25 23:22:53,866 - INFO - Sample 66 (gold): Gold triplets=52, Overlap=0, F1=0.000
 67%|██████▋   | 67/100 [1:27:43<51:13, 93.14s/it]2026-01-25 23:22:53,866 - INFO - Sample 67 has no CoT reasoning/triplets. Generating...
2026-01-25 23:23:01,552 - INFO - Sample 67 has no retrieved documents. Retrieving...
2026-01-25 23:24:24,687 - INFO - Sample 67: CoT triplets=6, Doc triplets=53, Overlap=0, F1=0.000
2026-01-25 23:24:24,688 - INFO - Sample 67 (gold): Gold triplets=16, Overlap=0, F1=0.000
 68%|██████▊   | 68/100 [1:29:14<49:18, 92.44s/it]2026-01-25 23:24:24,688 - INFO - Sample 68 has no CoT reasoning/triplets. Generating...
2026-01-25 23:24:31,109 - INFO - Sample 68 has no retrieved documents. Retrieving...
2026-01-25 23:25:46,711 - INFO - Sample 68: CoT triplets=4, Doc triplets=44, Overlap=0, F1=0.000
2026-01-25 23:25:46,712 - INFO - Sample 68 (gold): Gold triplets=28, Overlap=0, F1=0.000
 69%|██████▉   | 69/100 [1:30:36<46:08, 89.32s/it]2026-01-25 23:25:46,712 - INFO - Sample 69 has no CoT reasoning/triplets. Generating...
2026-01-25 23:25:51,941 - INFO - Sample 69 has no retrieved documents. Retrieving...
2026-01-25 23:27:01,027 - INFO - Sample 69: CoT triplets=4, Doc triplets=56, Overlap=0, F1=0.000
2026-01-25 23:27:01,028 - INFO - Sample 69 (gold): Gold triplets=13, Overlap=0, F1=0.000
 70%|███████   | 70/100 [1:31:50<42:24, 84.82s/it]2026-01-25 23:27:01,028 - INFO - Sample 70 has no CoT reasoning/triplets. Generating...
2026-01-25 23:27:08,607 - INFO - Sample 70 has no retrieved documents. Retrieving...
2026-01-25 23:28:22,466 - INFO - Sample 70: CoT triplets=5, Doc triplets=56, Overlap=0, F1=0.000
2026-01-25 23:28:22,467 - INFO - Sample 70 (gold): Gold triplets=15, Overlap=0, F1=0.000
 71%|███████   | 71/100 [1:33:12<40:30, 83.80s/it]2026-01-25 23:28:22,467 - INFO - Sample 71 has no CoT reasoning/triplets. Generating...
2026-01-25 23:28:34,583 - INFO - Sample 71 has no retrieved documents. Retrieving...
2026-01-25 23:29:56,211 - INFO - Sample 71: CoT triplets=4, Doc triplets=65, Overlap=0, F1=0.000
2026-01-25 23:29:56,212 - INFO - Sample 71 (gold): Gold triplets=17, Overlap=0, F1=0.000
 72%|███████▏  | 72/100 [1:34:46<40:30, 86.79s/it]2026-01-25 23:29:56,212 - INFO - Sample 72 has no CoT reasoning/triplets. Generating...
2026-01-25 23:30:04,090 - INFO - Sample 72 has no retrieved documents. Retrieving...
2026-01-25 23:31:18,724 - INFO - Sample 72: CoT triplets=6, Doc triplets=52, Overlap=0, F1=0.000
2026-01-25 23:31:18,724 - INFO - Sample 72 (gold): Gold triplets=20, Overlap=0, F1=0.000
 73%|███████▎  | 73/100 [1:36:08<38:28, 85.50s/it]2026-01-25 23:31:18,725 - INFO - Sample 73 has no CoT reasoning/triplets. Generating...
2026-01-25 23:31:24,284 - INFO - Sample 73 has no retrieved documents. Retrieving...
2026-01-25 23:32:35,825 - INFO - Sample 73: CoT triplets=4, Doc triplets=45, Overlap=0, F1=0.000
2026-01-25 23:32:35,826 - INFO - Sample 73 (gold): Gold triplets=30, Overlap=0, F1=0.000
 74%|███████▍  | 74/100 [1:37:25<35:57, 82.98s/it]2026-01-25 23:32:35,826 - INFO - Sample 74 has no CoT reasoning/triplets. Generating...
2026-01-25 23:32:43,713 - INFO - Sample 74 has no retrieved documents. Retrieving...
2026-01-25 23:33:55,466 - INFO - Sample 74: CoT triplets=5, Doc triplets=43, Overlap=0, F1=0.000
2026-01-25 23:33:55,467 - INFO - Sample 74 (gold): Gold triplets=24, Overlap=0, F1=0.000
 75%|███████▌  | 75/100 [1:38:45<34:09, 81.98s/it]2026-01-25 23:33:55,467 - INFO - Sample 75 has no CoT reasoning/triplets. Generating...
2026-01-25 23:34:04,695 - INFO - Sample 75 has no retrieved documents. Retrieving...
2026-01-25 23:35:34,119 - INFO - Sample 75: CoT triplets=6, Doc triplets=68, Overlap=0, F1=0.000
2026-01-25 23:35:34,120 - INFO - Sample 75 (gold): Gold triplets=19, Overlap=0, F1=0.000
 76%|███████▌  | 76/100 [1:40:24<34:47, 86.98s/it]2026-01-25 23:35:34,120 - INFO - Sample 76 has no CoT reasoning/triplets. Generating...
2026-01-25 23:35:44,712 - INFO - Sample 76 has no retrieved documents. Retrieving...
2026-01-25 23:37:26,569 - INFO - Sample 76: CoT triplets=8, Doc triplets=53, Overlap=0, F1=0.000
2026-01-25 23:37:26,569 - INFO - Sample 76 (gold): Gold triplets=34, Overlap=0, F1=0.000
 77%|███████▋  | 77/100 [1:42:16<36:16, 94.62s/it]2026-01-25 23:37:26,570 - INFO - Sample 77 has no CoT reasoning/triplets. Generating...
2026-01-25 23:37:32,505 - INFO - Sample 77 has no retrieved documents. Retrieving...
2026-01-25 23:38:34,903 - INFO - Sample 77: CoT triplets=4, Doc triplets=53, Overlap=0, F1=0.000
2026-01-25 23:38:34,903 - INFO - Sample 77 (gold): Gold triplets=12, Overlap=0, F1=0.000
 78%|███████▊  | 78/100 [1:43:24<31:48, 86.74s/it]2026-01-25 23:38:34,903 - INFO - Sample 78 has no CoT reasoning/triplets. Generating...
2026-01-25 23:38:40,220 - INFO - Sample 78 has no retrieved documents. Retrieving...
2026-01-25 23:39:41,730 - INFO - Sample 78: CoT triplets=4, Doc triplets=53, Overlap=0, F1=0.000
2026-01-25 23:39:41,730 - INFO - Sample 78 (gold): Gold triplets=14, Overlap=0, F1=0.000
 79%|███████▉  | 79/100 [1:44:31<28:16, 80.76s/it]2026-01-25 23:39:41,730 - INFO - Sample 79 has no CoT reasoning/triplets. Generating...
2026-01-25 23:39:47,381 - INFO - Sample 79 has no retrieved documents. Retrieving...
2026-01-25 23:40:55,648 - INFO - Sample 79: CoT triplets=4, Doc triplets=41, Overlap=0, F1=0.000
2026-01-25 23:40:55,648 - INFO - Sample 79 (gold): Gold triplets=18, Overlap=0, F1=0.000
 80%|████████  | 80/100 [1:45:45<26:14, 78.71s/it]2026-01-25 23:40:55,648 - INFO - Sample 80 has no CoT reasoning/triplets. Generating...
2026-01-25 23:41:06,002 - INFO - Sample 80 has no retrieved documents. Retrieving...
2026-01-25 23:42:15,497 - INFO - Sample 80: CoT triplets=6, Doc triplets=48, Overlap=0, F1=0.000
2026-01-25 23:42:15,498 - INFO - Sample 80 (gold): Gold triplets=18, Overlap=0, F1=0.000
 81%|████████  | 81/100 [1:47:05<25:01, 79.05s/it]2026-01-25 23:42:15,498 - INFO - Sample 81 has no CoT reasoning/triplets. Generating...
2026-01-25 23:42:20,811 - INFO - Sample 81 has no retrieved documents. Retrieving...
2026-01-25 23:43:15,459 - INFO - Sample 81: CoT triplets=4, Doc triplets=54, Overlap=0, F1=0.000
2026-01-25 23:43:15,460 - INFO - Sample 81 (gold): Gold triplets=8, Overlap=0, F1=0.000
 82%|████████▏ | 82/100 [1:48:05<21:59, 73.32s/it]2026-01-25 23:43:15,460 - INFO - Sample 82 has no CoT reasoning/triplets. Generating...
2026-01-25 23:43:23,016 - INFO - Sample 82 has no retrieved documents. Retrieving...
2026-01-25 23:44:45,569 - INFO - Sample 82: CoT triplets=6, Doc triplets=52, Overlap=0, F1=0.000
2026-01-25 23:44:45,570 - INFO - Sample 82 (gold): Gold triplets=24, Overlap=0, F1=0.000
 83%|████████▎ | 83/100 [1:49:35<22:12, 78.36s/it]2026-01-25 23:44:45,570 - INFO - Sample 83 has no CoT reasoning/triplets. Generating...
2026-01-25 23:44:52,071 - INFO - Sample 83 has no retrieved documents. Retrieving...
2026-01-25 23:46:03,326 - INFO - Sample 83: CoT triplets=4, Doc triplets=43, Overlap=0, F1=0.000
2026-01-25 23:46:03,326 - INFO - Sample 83 (gold): Gold triplets=28, Overlap=0, F1=0.000
 84%|████████▍ | 84/100 [1:50:53<20:50, 78.18s/it]2026-01-25 23:46:03,327 - INFO - Sample 84 has no CoT reasoning/triplets. Generating...
2026-01-25 23:46:12,812 - INFO - Sample 84 has no retrieved documents. Retrieving...
2026-01-25 23:47:16,417 - INFO - Sample 84: CoT triplets=5, Doc triplets=41, Overlap=0, F1=0.000
2026-01-25 23:47:16,417 - INFO - Sample 84 (gold): Gold triplets=18, Overlap=0, F1=0.000
 85%|████████▌ | 85/100 [1:52:06<19:09, 76.65s/it]2026-01-25 23:47:16,417 - INFO - Sample 85 has no CoT reasoning/triplets. Generating...
2026-01-25 23:47:25,791 - INFO - Sample 85 has no retrieved documents. Retrieving...
2026-01-25 23:48:34,256 - INFO - Sample 85: CoT triplets=4, Doc triplets=36, Overlap=0, F1=0.000
2026-01-25 23:48:34,257 - INFO - Sample 85 (gold): Gold triplets=22, Overlap=0, F1=0.000
 86%|████████▌ | 86/100 [1:53:24<17:58, 77.01s/it]2026-01-25 23:48:34,257 - INFO - Sample 86 has no CoT reasoning/triplets. Generating...
2026-01-25 23:48:45,058 - INFO - Sample 86 has no retrieved documents. Retrieving...
2026-01-25 23:50:05,374 - INFO - Sample 86: CoT triplets=7, Doc triplets=59, Overlap=0, F1=0.000
2026-01-25 23:50:05,374 - INFO - Sample 86 (gold): Gold triplets=25, Overlap=0, F1=0.000
 87%|████████▋ | 87/100 [1:54:55<17:36, 81.24s/it]2026-01-25 23:50:05,374 - INFO - Sample 87 has no CoT reasoning/triplets. Generating...
2026-01-25 23:50:10,704 - INFO - Sample 87 has no retrieved documents. Retrieving...
2026-01-25 23:51:45,652 - INFO - Sample 87: CoT triplets=4, Doc triplets=65, Overlap=0, F1=0.000
2026-01-25 23:51:45,652 - INFO - Sample 87 (gold): Gold triplets=25, Overlap=0, F1=0.000
 88%|████████▊ | 88/100 [1:56:35<17:23, 86.95s/it]2026-01-25 23:51:45,653 - INFO - Sample 88 has no CoT reasoning/triplets. Generating...
2026-01-25 23:51:50,644 - INFO - Sample 88 has no retrieved documents. Retrieving...
2026-01-25 23:52:56,399 - INFO - Sample 88: CoT triplets=4, Doc triplets=61, Overlap=0, F1=0.000
2026-01-25 23:52:56,400 - INFO - Sample 88 (gold): Gold triplets=10, Overlap=0, F1=0.000
 89%|████████▉ | 89/100 [1:57:46<15:02, 82.09s/it]2026-01-25 23:52:56,400 - INFO - Sample 89 has no CoT reasoning/triplets. Generating...
2026-01-25 23:53:02,017 - INFO - Sample 89 has no retrieved documents. Retrieving...
2026-01-25 23:53:56,717 - INFO - Sample 89: CoT triplets=4, Doc triplets=40, Overlap=0, F1=0.000
2026-01-25 23:53:56,717 - INFO - Sample 89 (gold): Gold triplets=13, Overlap=0, F1=0.000
 90%|█████████ | 90/100 [1:58:46<12:35, 75.56s/it]2026-01-25 23:53:56,717 - INFO - Sample 90 has no CoT reasoning/triplets. Generating...
2026-01-25 23:54:01,601 - INFO - Sample 90 has no retrieved documents. Retrieving...
2026-01-25 23:55:37,019 - INFO - Sample 90: CoT triplets=4, Doc triplets=51, Overlap=0, F1=0.000
2026-01-25 23:55:37,019 - INFO - Sample 90 (gold): Gold triplets=23, Overlap=0, F1=0.000
 91%|█████████ | 91/100 [2:00:26<12:26, 82.98s/it]2026-01-25 23:55:37,019 - INFO - Sample 91 has no CoT reasoning/triplets. Generating...
2026-01-25 23:55:46,752 - INFO - Sample 91 has no retrieved documents. Retrieving...
2026-01-25 23:56:28,419 - INFO - Sample 91: CoT triplets=5, Doc triplets=28, Overlap=0, F1=0.000
2026-01-25 23:56:28,420 - INFO - Sample 91 (gold): Gold triplets=10, Overlap=0, F1=0.000
 92%|█████████▏| 92/100 [2:01:18<09:48, 73.51s/it]2026-01-25 23:56:28,420 - INFO - Sample 92 has no CoT reasoning/triplets. Generating...
2026-01-25 23:56:34,007 - INFO - Sample 92 has no retrieved documents. Retrieving...
2026-01-25 23:58:23,097 - INFO - Sample 92: CoT triplets=4, Doc triplets=58, Overlap=0, F1=0.000
2026-01-25 23:58:23,098 - INFO - Sample 92 (gold): Gold triplets=52, Overlap=0, F1=0.000
 93%|█████████▎| 93/100 [2:03:13<10:01, 85.86s/it]2026-01-25 23:58:23,099 - INFO - Sample 93 has no CoT reasoning/triplets. Generating...
2026-01-25 23:58:28,197 - INFO - Sample 93 has no retrieved documents. Retrieving...
2026-01-25 23:59:45,821 - INFO - Sample 93: CoT triplets=4, Doc triplets=57, Overlap=0, F1=0.000
2026-01-25 23:59:45,822 - INFO - Sample 93 (gold): Gold triplets=18, Overlap=0, F1=0.000
 94%|█████████▍| 94/100 [2:04:35<08:29, 84.92s/it]2026-01-25 23:59:45,822 - INFO - Sample 94 has no CoT reasoning/triplets. Generating...
2026-01-25 23:59:51,509 - INFO - Sample 94 has no retrieved documents. Retrieving...
2026-01-26 00:01:38,369 - INFO - Sample 94: CoT triplets=4, Doc triplets=60, Overlap=0, F1=0.000
2026-01-26 00:01:38,370 - INFO - Sample 94 (gold): Gold triplets=55, Overlap=0, F1=0.000
 95%|█████████▌| 95/100 [2:06:28<07:46, 93.21s/it]2026-01-26 00:01:38,370 - INFO - Sample 95 has no CoT reasoning/triplets. Generating...
2026-01-26 00:01:43,925 - INFO - Sample 95 has no retrieved documents. Retrieving...
2026-01-26 00:02:46,713 - INFO - Sample 95: CoT triplets=4, Doc triplets=42, Overlap=0, F1=0.000
2026-01-26 00:02:46,714 - INFO - Sample 95 (gold): Gold triplets=18, Overlap=0, F1=0.000
 96%|█████████▌| 96/100 [2:07:36<05:42, 85.75s/it]2026-01-26 00:02:46,714 - INFO - Sample 96 has no CoT reasoning/triplets. Generating...
2026-01-26 00:02:54,755 - INFO - Sample 96 has no retrieved documents. Retrieving...
2026-01-26 00:04:00,812 - INFO - Sample 96: CoT triplets=6, Doc triplets=42, Overlap=0, F1=0.000
2026-01-26 00:04:00,813 - INFO - Sample 96 (gold): Gold triplets=21, Overlap=0, F1=0.000
 97%|█████████▋| 97/100 [2:08:50<04:06, 82.25s/it]2026-01-26 00:04:00,813 - INFO - Sample 97 has no CoT reasoning/triplets. Generating...
2026-01-26 00:04:11,012 - INFO - Sample 97 has no retrieved documents. Retrieving...
2026-01-26 00:05:26,816 - INFO - Sample 97: CoT triplets=5, Doc triplets=62, Overlap=0, F1=0.000
2026-01-26 00:05:26,817 - INFO - Sample 97 (gold): Gold triplets=5, Overlap=0, F1=0.000
 98%|█████████▊| 98/100 [2:10:16<02:46, 83.38s/it]2026-01-26 00:05:26,817 - INFO - Sample 98 has no CoT reasoning/triplets. Generating...
2026-01-26 00:05:34,045 - INFO - Sample 98 has no retrieved documents. Retrieving...
2026-01-26 00:06:46,677 - INFO - Sample 98: CoT triplets=5, Doc triplets=53, Overlap=0, F1=0.000
2026-01-26 00:06:46,677 - INFO - Sample 98 (gold): Gold triplets=11, Overlap=0, F1=0.000
 99%|█████████▉| 99/100 [2:11:36<01:22, 82.32s/it]2026-01-26 00:06:46,677 - INFO - Sample 99 has no CoT reasoning/triplets. Generating...
2026-01-26 00:06:52,442 - INFO - Sample 99 has no retrieved documents. Retrieving...
2026-01-26 00:08:03,635 - INFO - Sample 99: CoT triplets=4, Doc triplets=40, Overlap=0, F1=0.000
2026-01-26 00:08:03,635 - INFO - Sample 99 (gold): Gold triplets=45, Overlap=0, F1=0.000
100%|██████████| 100/100 [2:12:53<00:00, 80.71s/it]100%|██████████| 100/100 [2:12:53<00:00, 79.74s/it]
2026-01-26 00:08:03,687 - INFO - Results saved to: results/musique/graph_comparison/Qwen2.5-14B-Instruct/compare_graphs_train_sampled.json
2026-01-26 00:08:03,687 - INFO - 
=== Summary ===
2026-01-26 00:08:03,687 - INFO - Total samples: 100
2026-01-26 00:08:03,687 - INFO - Valid samples: 100
2026-01-26 00:08:03,687 - INFO - Average Precision: 0.000
2026-01-26 00:08:03,687 - INFO - Average Recall: 0.000
2026-01-26 00:08:03,687 - INFO - Average F1: 0.000
2026-01-26 00:08:03,688 - INFO - 
=== Gold Summary ===
2026-01-26 00:08:03,688 - INFO - Gold valid samples: 100
2026-01-26 00:08:03,688 - INFO - Gold Average Precision: 0.000
2026-01-26 00:08:03,688 - INFO - Gold Average Recall: 0.000
2026-01-26 00:08:03,688 - INFO - Gold Average F1: 0.000
