/data3/seonhoyoo/.conda/envs/graphcheck/lib/python3.10/site-packages/transformers/utils/hub.py:110: FutureWarning: Using `TRANSFORMERS_CACHE` is deprecated and will be removed in v5 of Transformers. Use `HF_HOME` instead.
  warnings.warn(
Fetching 4 files:   0%|          | 0/4 [00:00<?, ?it/s]Fetching 4 files:  25%|██▌       | 1/4 [07:33<22:40, 453.61s/it]Fetching 4 files: 100%|██████████| 4/4 [07:33<00:00, 113.40s/it]
2026-01-26 14:50:44,690 - INFO - We will use 90% of the memory on device 0 for storing the model, and 10% for the buffer to avoid OOM. You can set `max_memory` in to a higher value to use more memory (at your own risk).
Loading checkpoint shards:   0%|          | 0/4 [00:00<?, ?it/s]Loading checkpoint shards:  25%|██▌       | 1/4 [00:34<01:44, 34.95s/it]Loading checkpoint shards:  50%|█████     | 2/4 [01:12<01:12, 36.46s/it]Loading checkpoint shards:  75%|███████▌  | 3/4 [02:03<00:42, 42.94s/it]Loading checkpoint shards: 100%|██████████| 4/4 [02:38<00:00, 40.14s/it]Loading checkpoint shards: 100%|██████████| 4/4 [02:38<00:00, 39.74s/it]
2026-01-26 14:53:27,007 - INFO - Processing 10 samples...
2026-01-26 14:53:27,007 - INFO - Using model: Qwen/Qwen2.5-7B-Instruct
2026-01-26 14:53:27,007 - INFO - Retriever URL: http://127.0.0.1:8000/retrieve
2026-01-26 14:53:27,007 - INFO - BM25 top_k: 5
  0%|          | 0/10 [00:00<?, ?it/s]2026-01-26 14:53:27,008 - INFO - Sample 0 has no CoT reasoning/triplets or force regen is set. Generating...
The following generation flags are not valid and may be ignored: ['top_k']. Set `TRANSFORMERS_VERBOSITY=info` for more details.
2026-01-26 14:53:34,605 - INFO - Sample 0: retry CoT generation (1/3)
2026-01-26 14:53:41,735 - INFO - Sample 0: retry CoT generation (2/3)
2026-01-26 14:53:48,870 - INFO - Sample 0: retry CoT generation (3/3)
2026-01-26 14:53:56,002 - WARNING - Sample 0 CoT generation yielded empty output after retries.
2026-01-26 14:53:56,003 - INFO - Sample 0 has no retrieved documents. Retrieving...
2026-01-26 14:53:56,003 - WARNING - Sample 0: CoT reasoning is empty, falling back to question
2026-01-26 14:54:55,023 - INFO - Sample 0: CoT triplets=7, Doc triplets=75, Overlap=0, F1=0.000
2026-01-26 14:54:55,024 - INFO - Sample 0 (gold): Gold triplets=35, Overlap=0, F1=0.000
 10%|█         | 1/10 [01:28<13:12, 88.02s/it]2026-01-26 14:54:55,024 - INFO - Sample 1 has no CoT reasoning/triplets or force regen is set. Generating...
2026-01-26 14:54:58,104 - INFO - Sample 1: retry CoT generation (1/3)
2026-01-26 14:55:01,185 - INFO - Sample 1: retry CoT generation (2/3)
2026-01-26 14:55:04,265 - INFO - Sample 1: retry CoT generation (3/3)
2026-01-26 14:55:07,346 - WARNING - Sample 1 CoT generation yielded empty output after retries.
2026-01-26 14:55:07,346 - INFO - Sample 1 has no retrieved documents. Retrieving...
2026-01-26 14:55:07,346 - WARNING - Sample 1: CoT reasoning is empty, falling back to question
2026-01-26 14:55:45,461 - INFO - Sample 1: CoT triplets=4, Doc triplets=57, Overlap=0, F1=0.000
2026-01-26 14:55:45,461 - INFO - Sample 1 (gold): Gold triplets=17, Overlap=0, F1=0.000
 20%|██        | 2/10 [02:18<08:47, 65.91s/it]2026-01-26 14:55:45,462 - INFO - Sample 2 has no CoT reasoning/triplets or force regen is set. Generating...
2026-01-26 14:55:54,335 - INFO - Sample 2: retry CoT generation (1/3)
2026-01-26 14:56:03,206 - INFO - Sample 2: retry CoT generation (2/3)
2026-01-26 14:56:12,083 - INFO - Sample 2: retry CoT generation (3/3)
2026-01-26 14:56:20,958 - WARNING - Sample 2 CoT generation yielded empty output after retries.
2026-01-26 14:56:20,958 - INFO - Sample 2 has no retrieved documents. Retrieving...
2026-01-26 14:56:20,958 - WARNING - Sample 2: CoT reasoning is empty, falling back to question
2026-01-26 14:56:52,677 - INFO - Sample 2: CoT triplets=8, Doc triplets=40, Overlap=0, F1=0.000
2026-01-26 14:56:52,677 - INFO - Sample 2 (gold): Gold triplets=13, Overlap=0, F1=0.000
 30%|███       | 3/10 [03:25<07:45, 66.51s/it]2026-01-26 14:56:52,677 - INFO - Sample 3 has no CoT reasoning/triplets or force regen is set. Generating...
2026-01-26 14:56:58,756 - INFO - Sample 3: retry CoT generation (1/3)
2026-01-26 14:57:04,833 - INFO - Sample 3: retry CoT generation (2/3)
2026-01-26 14:57:10,912 - INFO - Sample 3: retry CoT generation (3/3)
2026-01-26 14:57:16,997 - WARNING - Sample 3 CoT generation yielded empty output after retries.
2026-01-26 14:57:16,998 - INFO - Sample 3 has no retrieved documents. Retrieving...
2026-01-26 14:57:16,998 - WARNING - Sample 3: CoT reasoning is empty, falling back to question
2026-01-26 14:57:47,719 - INFO - Sample 3: CoT triplets=7, Doc triplets=40, Overlap=0, F1=0.000
2026-01-26 14:57:47,719 - INFO - Sample 3 (gold): Gold triplets=19, Overlap=0, F1=0.000
 40%|████      | 4/10 [04:20<06:11, 61.98s/it]2026-01-26 14:57:47,719 - INFO - Sample 4 has no CoT reasoning/triplets or force regen is set. Generating...
2026-01-26 14:57:56,516 - INFO - Sample 4 has no retrieved documents. Retrieving...
2026-01-26 14:57:56,516 - INFO - Sample 4: Using CoT reasoning for retrieval
2026-01-26 14:58:28,873 - INFO - Sample 4: CoT triplets=10, Doc triplets=41, Overlap=0, F1=0.000
2026-01-26 14:58:28,873 - INFO - Sample 4 (gold): Gold triplets=15, Overlap=0, F1=0.000
 50%|█████     | 5/10 [05:01<04:32, 54.47s/it]2026-01-26 14:58:28,873 - INFO - Sample 5 has no CoT reasoning/triplets or force regen is set. Generating...
2026-01-26 14:58:38,551 - INFO - Sample 5 has no retrieved documents. Retrieving...
2026-01-26 14:58:38,551 - INFO - Sample 5: Using CoT reasoning for retrieval
2026-01-26 14:59:07,578 - INFO - Sample 5: CoT triplets=9, Doc triplets=37, Overlap=0, F1=0.000
2026-01-26 14:59:07,578 - INFO - Sample 5 (gold): Gold triplets=13, Overlap=0, F1=0.000
 60%|██████    | 6/10 [05:40<03:16, 49.11s/it]2026-01-26 14:59:07,578 - INFO - Sample 6 has no CoT reasoning/triplets or force regen is set. Generating...
2026-01-26 14:59:13,355 - INFO - Sample 6 has no retrieved documents. Retrieving...
2026-01-26 14:59:13,356 - INFO - Sample 6: Using CoT reasoning for retrieval
2026-01-26 14:59:48,301 - INFO - Sample 6: CoT triplets=5, Doc triplets=39, Overlap=0, F1=0.000
2026-01-26 14:59:48,302 - INFO - Sample 6 (gold): Gold triplets=20, Overlap=0, F1=0.000
 70%|███████   | 7/10 [06:21<02:19, 46.37s/it]2026-01-26 14:59:48,302 - INFO - Sample 7 has no CoT reasoning/triplets or force regen is set. Generating...
2026-01-26 14:59:54,711 - INFO - Sample 7 has no retrieved documents. Retrieving...
2026-01-26 14:59:54,711 - INFO - Sample 7: Using CoT reasoning for retrieval
2026-01-26 15:00:33,529 - INFO - Sample 7: CoT triplets=6, Doc triplets=43, Overlap=0, F1=0.000
2026-01-26 15:00:33,529 - INFO - Sample 7 (gold): Gold triplets=23, Overlap=0, F1=0.000
 80%|████████  | 8/10 [07:06<01:32, 46.01s/it]2026-01-26 15:00:33,529 - INFO - Sample 8 has no CoT reasoning/triplets or force regen is set. Generating...
2026-01-26 15:00:40,312 - INFO - Sample 8: retry CoT generation (1/3)
2026-01-26 15:00:47,094 - INFO - Sample 8: retry CoT generation (2/3)
2026-01-26 15:00:53,875 - INFO - Sample 8: retry CoT generation (3/3)
2026-01-26 15:01:00,656 - WARNING - Sample 8 CoT generation yielded empty output after retries.
2026-01-26 15:01:00,656 - INFO - Sample 8 has no retrieved documents. Retrieving...
2026-01-26 15:01:00,656 - WARNING - Sample 8: CoT reasoning is empty, falling back to question
2026-01-26 15:01:30,447 - INFO - Sample 8: CoT triplets=6, Doc triplets=34, Overlap=0, F1=0.000
2026-01-26 15:01:30,447 - INFO - Sample 8 (gold): Gold triplets=14, Overlap=0, F1=0.000
 90%|█████████ | 9/10 [08:03<00:49, 49.42s/it]2026-01-26 15:01:30,447 - INFO - Sample 9 has no CoT reasoning/triplets or force regen is set. Generating...
2026-01-26 15:01:35,923 - INFO - Sample 9 has no retrieved documents. Retrieving...
2026-01-26 15:01:35,923 - INFO - Sample 9: Using CoT reasoning for retrieval
2026-01-26 15:02:09,476 - INFO - Sample 9: CoT triplets=5, Doc triplets=47, Overlap=0, F1=0.000
2026-01-26 15:02:09,476 - INFO - Sample 9 (gold): Gold triplets=15, Overlap=0, F1=0.000
100%|██████████| 10/10 [08:42<00:00, 46.21s/it]100%|██████████| 10/10 [08:42<00:00, 52.25s/it]
2026-01-26 15:02:09,487 - INFO - Results saved to: results/musique/graph_comparison/Qwen2.5-7B-Instruct/compare_graphs_train_sampled.json
2026-01-26 15:02:09,487 - INFO - 
=== Summary ===
2026-01-26 15:02:09,487 - INFO - Total samples: 10
2026-01-26 15:02:09,487 - INFO - Valid samples: 10
2026-01-26 15:02:09,487 - INFO - Average Precision: 0.000
2026-01-26 15:02:09,487 - INFO - Average Recall: 0.000
2026-01-26 15:02:09,487 - INFO - Average F1: 0.000
2026-01-26 15:02:09,487 - INFO - 
=== Gold Summary ===
2026-01-26 15:02:09,487 - INFO - Gold valid samples: 10
2026-01-26 15:02:09,487 - INFO - Gold Average Precision: 0.000
2026-01-26 15:02:09,487 - INFO - Gold Average Recall: 0.000
2026-01-26 15:02:09,487 - INFO - Gold Average F1: 0.000
